title,date,content,url
[부자됩시다] 마이너스 대출 금리 얕보지 마세요,2005-05-29 14:08:00,"저금리가 계속되면서 저축에 따른 이자로 재산 불리기가 무척 힘들어졌다. 저축할 여윳돈이 있는 사람도 많지 않다. 저축보다는 은행의 마이너스통장 대출, 신용카드 의 현금서비스, 할부금융사나 상호저축은행 등의 대출 등을 이용하고 있는 게 대다 수 직장인들의 현실이다. 특히 마이너스통장 대출은 일정한 소득과 직업, 신용등급 등을 갖춘 직장인들이 대 부분 이용한다. 다른 급전에 비해 대출 이자가 싸다는 장점도 있다. 하지만 마이너 스 대출이 어떻게 구성돼 있는지, 서비스와 이자 계산은 어떻게 하는지 등을 아는 사람은 거의 없다. 얄팍해진 월급 봉투를 보며 씁쓸해 하는 직장인들을 위한 '마이 너스대출 100% 이용법'을 알아보자. ◆ 마이너스대출이란＝미리 필요한 일정금액의 대출한도를 정하고 정해전 범위 내 에서 고객이 실제로 사용한 금액에 대해서만 이자를 내는 대출이다. 정식 명칭은 가계신용대출로 한도대출이다. 하지만 대출을 쓴 만큼 통장 잔액란에 마이너스로 표시되기 때문에 모든 사람들이 '마이너스 대출'이라고 부른다. 고객이 대출기간에 한 번도 마이너스대출을 이용하 지 않는다면 이자를 내지 않아도 된다. 대출을 해주는 은행 입장에선 고객이 필요 한 자금을 준비해도 고객이 사용하지 않으면 비용만 발생되므로 마이너스 대출은 일반대출보다 0.5%포인트 정도 높은 이자율을 적용하는 게 일반적이다. 따라서 마 이너스 대출은 소액 또는 일시적인 가계자금에 한정해서 사용하는 게 좋다. ◆ 마이너스 대출의 장점＝마이너스 대출의 장점은 대출과 결제가 편리하다는 점이 다. 일단 한 번 만들어 두면 돈이 필요할 때마다 수시로 빼서 쓸 수 있다. 이자도 대출한 금액에 대해서만 물면 되고, 여유가 있어 돈을 채워 넣어 예금 잔액을 플러 스 상태로 만들면 더 이상 이자를 물지 않아도 된다. 자영업자나 월급여를 받는 급 여생활자에게는 적합한 대출이다. 마이너스 통장으로 급여를 이체하면 금리 부담을 조금이라도 덜 수 있다. 월급이 입출되면서 대출이 상환되기 때문이다. 아울러 매월 결제해야 하는 신용카드 대금, 공과금, 지로, 아파트관리비 등을 마이너스 통장과 연결해 놓으면 이자를 조금이라 도 줄일 수 있다. 조흥은행은 급여이체 0.1%포인트, 타행대출 대환 0.1%포인트, 당 행 신용카드 소지자 0.1%포인트, 아파트관리비 자동이체 0.1%포인트, 조흥 장기모 기지론 보유고객 0.1%포인트, 적립식 예금가입고객 0.1%포인트 등 최고 0.4%포인트 까지 우대해 준다. ◆ 마이너스대출의 이자＝마이너스대출의 이자는 매일 매일 사용 잔액을 기준으로 계산된다. 매일 계산된 이자는 매월 징수된다. 따라서 여윳돈이 생기면 마이너스 통장에 입금하는 등 대출 잔고를 줄여야 한다. 또 공과금 등 연결계좌의 이체 날짜 는 가능한 마이너스 통장에 여윳돈이 생기는 시점 직후(월급날 직후)로 설정하는 게 바람직하다. 은행간 마이너스대출에 대한 이자도 다르다. 고객의 신용등급별로 금리가 차등 적 용되지만 본인에게 가장 유리한 금리를 선택해야 한다. 특히 기존의 마이너스대출 은 이자가 연 9~13% 수준이었는데 요즘 외환은행은 연 6.5%까지 낮출 수 있다. 대출금리를 평가하고 결정하는 항목이 금융기관마다 달라 동일한 사람이라도 은행 마다 마이너스대출 금리가 다를 수 있어 자신에게 가장 낮은 금리로 대출할 수 있 는 곳을 찾아야 한다. 금리나 대출한도 등에 우대를 받을 수 있는 마이너스대출로 갈아타기를 할 필요가 있다는 얘기다. '발품'을 팔지 않더라도 인터넷을 이용해 각 은행 홈페이지를 활용하면 최저 금리 로 대출이 가능한 곳을 찾을 수 있다. 다만 낮은 금리를 찾기 위해 일정 기간에 여 러 군데 금융기관에 대출신청을 하게 되면 신용조회 기록이 누적돼 개인 신용에 나 쁜 영향을 줄 수도 있다. 외환은행 관계자는 ""은행들이 모든 고객을 구분해서 운용하는 만큼 발품을 팔아야 한다""면서 ""기존의 마이너스 대출은 대략 9% 내외인 만큼 갈아타기를 할 필요가 있 다"" ◆ 마이너스대출의 주의할 점＝마이너스대출이 가능한 고객은 카드대출을 이용하면 무조건 손해를 본다. 카드대출은 기본금리가 연 15% 이상이다. 연 15% 금리면 200 만원을 빌릴 때 월 2만5000원의 이자를 내야 한다는 것이다. 반면 마이너스대출로 200만원을 빌리면 이자 7%인 경우 월 1만1600원만 내면 된다. 마이너스 대출을 사용할 때는 대출약정 한도의 90% 정도 사용하는 습관을 들여야 한다. 대출한도를 챙기지 않으면 자기도 모르는 사이에 약정 한도를 초과하게 된다 . 더욱이 지난 2월부터 마이너스대출을 받은 뒤 대출이자를 1개월 이상 연체하면 대 출원금에 대해서도 연체이자가 부과되도록 제도가 바뀌었다. 연체이자는 연 17~18% 에 달한다. 이전에는 연체가 발생하면 이자에 대해서만 연체 이자를 부과했다. 따라서 마이너 스대출을 받을 경우 연체가 발생하지 않도록 한도 여유를 남겨 놓는 것이 좋다. 금리조정 요구권도 활용하는 게 좋다. 일정계약 기간에 고객이 특별히 요청하지 않 으면 은행에서 자동으로 내려주는 법이 없기 때문이다. 소득이 늘거나 신용 상태가 개선됐다면 거래하는 은행에 달려가서 금리인하를 요청해야 한다. 자신의 장기거래 예금이 있다면 이를 담보로 하는 것도 이자를 줄이는 방법이다. 한상언 신한은행 재테크 팀장은 ""마이너스 통장 대출은 신용대출이지만 담보대출도 가능하다""면서 ""예금 적금 등을 담보로 하면 대출금리가 조금은 싸다""고 말했다. 아울러 마이너스대출 기간을 연장할 때도 반드시 은행을 방문해 금리를 꼭 확인해 야 한다. 은행들은 마이너스대출을 받은 고객의 신용등급이 떨어지는 경우가 아니 면 전화 등을 통해 본인 의사를 확인한 후 자동 연장해 주는 조치를 취한다. [윤상환 기자] < Copyright ⓒ 매일경제. 무단전재 및 재배포 금지 >",https://n.news.naver.com/mnews/article/009/0000442393?sid=101
남북경협株 강세 지속될까,2005-05-16 16:53:00,"남북 차관급 회담이 10개월 만에 재개된 16일 주가는 소폭 상승세를 기록했다. 경협 관련주들은 모처럼 맞은 호재를 바탕으로 동반 오름세를 보였다. 하지만 이번 회담이 '북핵 리스크'에 따른 증시 불안 현상을 잠재우기는 힘들 것이라 고 증시 전문가들은 진단했다. '북핵 리스크'의 열쇠는 미국 중국 등이 갖고 있는 만큼 큰 기대를 걸기 어렵 다는 진단이다. 이날 종합주가지수는 전거래일 대비 0.63% 오른 929.04에 마감 하며 이틀 연속 소폭 상승세를 이어갔다. 이날 시장에서는 남북회담 재개 소식으로 비료업체 등 경제협력 관련주가 강세 를 보였다. 남북 경협주가 증시에서 차지하는 비중은 낮아 전체적인 증시 상승 모멘텀을 이끌기는 어려울 것으로 예측됐다. 이날 증시에서는 비료업체, 대북사업자, 개선공단 입주업체 등이 대체로 강세 를 보였다. 남해화학과 조선비료는 상한가를 기록했으며 동부한농은 8.25% 상승세를 기록 했다. 대북사업자 현대아산의 주요 주주인 현대상사는 3.15% 올랐으나 현대건설은 0. 23% 하락했다. 개성공단 입주 업체 신원과 로만손은 각각 1.19%, 2.54% 상승했지만 재영솔루 텍은 0.45% 하락했다. ◆ '북핵 리스크' 잠재우기 어려워＝이번 남북 차관급 회담의 주요 의제는 그 동안 중단됐던 남북관계 정상화, 북핵문제, 비료지원 등이다. 가장 큰 관심 포인트는 과연 북핵문제를 풀기 위한 해법을 찾을 수 있느냐에 초점이 맞춰져 있다. 그러나 증시 전문가들은 이러한 기대감을 갖기 어렵다는 평가를 내리고 있다. 유동원 씨티그룹 스미스바니 상무는 ""북핵 리스크를 둘러싼 미국 시각이 변화 기미를 보이지 않고 있어 북핵 리스크는 상당히 지속될 것""이라고 말했다. 그는 이어 ""남북 차관급 회담이 열렸지만 여기서 실질적인 북핵 리스크 해법을 찾기는 어려울 것""이라며 ""특히 최근 수출이 둔화되고 있는 데다 내수경기 회 복도 불투명해 5~6월 내 주가는 870선까지 밀려날 수 있다""고 지적했다. 이남우 메릴린치 리서치센터장은 ""이날 주가는 오름세를 기록했지만 남북 차관 급 회담 개최에 따른 영향이라고 해석하기 어렵다""며 ""북핵 리스크 시나리오 전개 방향의 열쇠를 쥐고 있는 당사자는 중국""이라고 말했다. 그는 ""남북 차관급 회담 개최로 실질적인 돌파구를 찾기는 어려울 것""이라며 "" 북핵 리스크가 계속해서 증시 디스카운트 요인으로 작용할 것으로 예상돼 올해 한국 증시가 재평가되기는 힘들다""고 평가했다. 메릴린치는 북핵 리스크 전개 상황을 지켜봐야 하지만 당분간 주가가 900선을 중심으로 횡보할 가능성이 높다고 내다봤다. ◆ 국내 증권사는 다소 긍정적 시각＝북핵 리스크를 둘러싼 증권사들의 의견을 살펴보면 그나마 국내 증권사들이 긍정적인 시각을 보이고 있다. 김영익 대신증권 리서치센터장은 ""북핵 리스크가 고조되고 있어도 증시는 하루 이틀 충격에 그치고 있지만 앞으로 어떤 식으로 진행될지는 미지수""라며 ""다만 남북 차관급 회담을 통해 대화 창구를 열어가는 것은 시장에 긍정적 요인""이라 고 진단했다. 그는 이어 ""북핵문제가 한국에 내재된 고유 변수라고 놓고 이를 제외할 경우 국내 증시는 다음달부터 내수회복 기대가 반영되면서 상승세로 돌아설 수 있다 ""며 ""6월까지 종합주가지수는 900선에서 980선까지 움직일 것""으로 전망했다. 정태욱 현대증권 리서치센터장은 ""현실적으로 북핵문제는 충돌하거나 긍정적인 결말을 기대해볼 만한 선상에 놓였다""며 ""다만 이런 변수들을 예단해서 초과 수익을 누리는 것을 불가능하다""고 설명했다. 그는 ""북핵문제에 민감하게 반응하기보다는 △미국 경기의 소프트패치 문제 △ 미국 금리 인상 속도 △위안화 절상문제 등 대외 변수를 예의주시해야 한다""고 지적했다. [장용승 기자 / 강계만 기자] < Copyright ⓒ 매일경제. 무단전재 및 재배포 금지 >",https://n.news.naver.com/mnews/article/009/0000440382?sid=101
"""우리금융 국내 자본에 매각을""",2005-05-10 16:26:00,"앞으로 우리금융지주 등 정부 소유 금융기관을 민영화할 때 외국 금융기관보다 국내 사모펀드 등 국내 자본에 매각하는 것이 바람직하다는 주장이 제기됐다. 외환위기 이래 제일ㆍ외환 등 국내 은행을 외국 펀드에 매각한 효과를 실증 분 석해본 결과 은행산업 효율성을 높이는 데 기여하지 못한 것으로 나타났기 때 문이다. 한국은행 금융경제연구원은 10일 '외국 금융기관 진입이 국내 은행산업에 미친 영향'이라는 보고서에서 2000년 이래 외국 사모펀드에 의한 국내 은행 인수가 국내 은행 안정성 개선에는 기여했으나 비용 효율성은 개선시키지 못한 것으로 나타났다고 밝혔다. 또 외국계 은행들이 내국계 은행에 비해 중소기업 대출 비중을 크게 낮추고 가 계대출 비중은 확대하는 등 안전자산 위주 영업에 치중함으로써 은행의 금융중 개 기능도 약화된 것으로 파악됐다. 금융경제연구원은 은행의 안정성 지표인 무수익여신비율은 외국계 은행이 2000 년 7.6%에서 2004년에는 1.2%로 6.3%포인트 낮아졌고 국내 은행도 같은 기간 이 비율이 6.5%에서 1.7%로 4.8%포인트 낮아져 안정성은 개선된 것으로 나타났 다. 반면 비용 효율성을 나타내는 총자산 대비 총비용 비율은 외국계 은행이 0.8% 포인트, 국내 은행이 4.3%포인트 줄어든 것으로 조사됐다. 금융경제연구원은 안정성 지표에 비해 효율성지표 개선 정도가 상대적으로 적 었고 효율성지표 개선 요인도 수신금리 인하에 따른 효과가 큰 만큼 외국 은행 진출로 비용 효율성이 개선됐다고 보기는 힘들다고 지적했다. 강종만 금융경제연구원 차장은 ""외국계 사모펀드가 은행 가치를 높여 매매차익 을 극대화할 목적으로 안정성 제고에 주력함에 따라 국내 은행도 이들과 경쟁 과정에서 안정성을 높이는 데 주력한 것이 이 같은 결과를 낳았다""고 말했다. [노영우 기자] < Copyright ⓒ 매일경제. 무단전재 및 재배포 금지 >",https://n.news.naver.com/mnews/article/009/0000439361?sid=101
[금융 신상품] 국고채 年 3.70~3.85%,2005-05-08 13:11:00,"지난주 금리는 방향성이 없이 좁은 범위에서 등락했다. 미국 경제지표가 다소 부진한 모습이었지만 글로벌 경기 둔화조짐이 국내 금리에 반영된 측면이 있었 다. 3월 서비스업 생산이 플러스를 기록했지만 증가폭이 놀랄 만한 수준은 아 니었다. 이번주 금리도 레인지 장세를 크게 벗어나진 않을 전망이다. 주 초반 국고채 5 년물 입찰물량이 1조9000억원으로 다소 많지만 장기물 스프레드 축소에 관심이 많은 상황에서 입찰이 크게 부진할 가능성은 낮아 보인다. 한편 오는 12일 열릴 5월 금융통화위원회에서는 콜금리 동결이 예상된다. 결정 자체보다는 통화당국의 물가, 부동산 관련 코멘트에 관심이 필요하다는 판단이 다. 이번주 지표금리(3년만기 국고채 수익률)는 연 3.70~3.85%에서 움직일 전 망이다. [김형기 대우증권 채권애널리스트] < Copyright ⓒ 매일경제. 무단전재 및 재배포 금지 >",https://n.news.naver.com/mnews/article/009/0000438733?sid=101
美금리 0.25%P 인상 유력,2005-05-02 17:11:00,미국 연방준비제도이사회(FRB)의 연방공개시장위원회(FOMC)가 3일(현지시간)로 예정된 정례회의에서 연방기금 금리를 또 0.25%포인트 인상할 것이라는 점에 대해 시장이 일치된 의견을 보이고 있다. AP 로이터통신 CBS마켓워치 등 주요 매체들에 따르면 월가 전문가들은 인플레 이션을 억제하면서 미국 경제가 견고한 성장세를 유지할 수 있도록 FRB가 이번 에도 기준금리를 0.25%포인트 인상할 것으로 전망했다. 최근 인플레이션에 대한 염려가 커지고 있는 가운데 미국의 1분기 성장률이 예 상보다 낮게 집계됨에 따라 이번 정례회의에 월가를 비롯한 세계 금융시장들이 촉각을 곤두세우고 있다. 금리 인상 여부나 폭보다 더 관심을 끌고 있는 것은 회의 후 발표될 결정문 내 용이다. 전문가들은 FRB가 지난 3월 정례회의에서 인플레이션 염려를 강조한 것과 관련 해 이번 회의에서도 '점진적' 금리인상 기조라는 표현을 그대로 유지할 것인지 여부를 놓고 논란이 벌어질 것으로 보고 있다. 만약 '점진적'이라는 표현이 그대로 사용될 때 미 연준이 인플레이션 억제를 자신하고 경기 하강을 일시적인 현상으로 파악하고 있다는 시그널로 받아들여 지면서 증시에 호재로 작용할 전망이다. 그러나 반대로 발표문에서 키워드가 바뀔 경우엔 향후 금리정책에 대한 불확실성이 가중되면서 다우지수 1만선이 위협받게 될 것으로 전문가들은 관측하고 있다. 이 같은 불확실성에 따른 불안 감으로 인해 다우지수는 지난 4월 2.96% 떨어진 바 있다. [워싱턴 = 서정희 특파원] < Copyright ⓒ 매일경제. 무단전재 및 재배포 금지 >,https://n.news.naver.com/mnews/article/009/0000437840?sid=101
주식형펀드 12조원 육박,2005-05-18 17:08:00,주식시장의 조정에도 불구하고 순수 주식형펀드로 꾸준히 돈이 들어오면서 수 탁고가 12조원에 바짝 다가섰다. 18일 자산운용협회에 따르면 지난 16일 현재 주식형펀드 수탁고는 11조9420억 원으로 전날보다 1760억원 늘어났다. 주식형펀드(주식 편입비율 60% 이상) 수탁고는 지난해 말 8조5520억원에서 3조 3000억원(38.6%) 늘었으며 지난 5개월여 간 잔고가 줄어든 날은 단 10여 일에 불과했다. 이 기간 종합주가지수가 1000선을 찍은 뒤 비틀거리며 한때 900선까지 위협받 기도 했지만 주식형펀드에서 자금이 빠져나가는 모습은 눈에 띄지 않았다. 오히려 지난 2월 중순에 9조원을 돌파한 뒤 한 달도 안돼 10조원을 넘고 지난 달 20일에는 11조원을 찍는 등 전체 펀드의 증가속도가 비교적 일정하게 유지 됐다. 증시 전문가들은 적립식 펀드 열풍이 이어지고 있는 데다 증시에 대한 기대감이 살아 있기 때문으로 분석하고 있다. 이러한 추세가 이어진다면 수탁고가 조만간 과거 기록을 넘어설 것으로 보인다 . 주식형펀드 수탁고는 2003년 4월 중순의 12조130억원이 2000년 6월 말 집계를 시작한 이래 최대 규모로 기록되고 있다. 한편 주식형펀드를 포함해 전체 펀드 수탁고는 지난해 말 187조원에서 197조60 00억원으로 10조6000억원 늘어나면서 200조원 시대 개막을 눈앞에 두고 있다. 이 가운데 머니마켓펀드(MMF)가 지난해 말 59조8000억원에서 69조8460억원으로 약 10조원 불어났지만 채권형펀드는 연초 금리 상승 충격에 75조8000억원에서 64조9340억원으로 10조8660억원 줄었다. [김경도 기자] < Copyright ⓒ 매일경제. 무단전재 및 재배포 금지 >,https://n.news.naver.com/mnews/article/009/0000440769?sid=101
대출한도 3천만원 줄어들 듯,2005-05-12 07:32:00,"은행 주택담보대출 금리는 오르고 대출한도는 줄어들 전망이다. 금융감독원은 11일 시중은행에 보낸 공문에서 ""무분별한 주택담보대출 경쟁으 로 은행 건전성이 악화될 우려가 있다""며 ""금리경쟁을 자제하고 대출한도 편법 확대 행위를 금지해 줄 것""을 공식 요구했다. 그 동안 은행들은 기업대출은 축소하고 안전성이 높은 주택대출을 확대하는 정 책을 앞다퉈 시행하면서 주택담보대출 금리는 계속 낮아지고 대출한도는 확대 해 왔다. 이러한 은행들 행태는 은행 건전성을 훼손시키고 은행 수익성이 오히려 낮아지 는 '승자의 재앙'을 초래할 가능성도 높은 것으로 지적됐다. 은행들은 앞으로 주택대출 금리도 현실화하고 대출한도도 축소시킬 것으로 예 상된다. 고객 입장에서는 대출 계획이 있다면 빨리 대출받는 것이 보다 유리한 조건에서 대출받을 수 있는 방법이다. 감독원 요구사항은 △원가보다 낮은 대출금리 적용 금지 △주택대출 한도 편법 확대 금지 △이주비 대출에도 주택대출 한도 준수 등 3가지다. 시중은행이 현 재 적용하고 있는 3개월 변동금리 조건으로 주택담보대출 금리는 연 4.2~6% 선 이다. 은행들은 신규 고객 확보를 위해 대출받은 후 초기 6개월간은 0.3~0.7%포인트 금리를 깎아주고 있다. 은행마다 차이는 있지만 대출 원가는 3개월 양도성예금금리(CD) 3.5%에 인건비 등 각종 부대비용 1% 정도를 합해 연 4.5% 안팎이다. 은행 관계자는 ""주택대출을 실시할 때 초기 1년 동안은 원가에 미치지 못하는 금리를 적용하고 있어 역마진이 발생하는 상황""이라고 말했다. 서울 강서 화곡 지구, 길음동 등 재건축아파트 단지에서 실시되는 집단대출은 금리경쟁이 더욱 치열해 연 3.7%대까지 대출금리가 떨어졌다. 집단대출은 우수 고객 확보라는 미명 아래 대출 원가보다 0.5%포인트 이상 낮은 금리로 대출을 실시하고 있다. 은행들은 조만간 지점장 전결로 금리를 못 낮추도록 하는 등 대출금리를 현실 화하는 작업에 착수할 것으로 보인다. 시중은행 관계자는 ""금리인상 필요성은 있지만 먼저 금리를 올릴 때 고객 이탈 등이 염려돼 타은행 눈치를 보고 있다""며 ""국민ㆍ신한ㆍ우리 등 대형 은행이 주택대출 금리를 올린다면 다른 은행도 곧 따라갈 것""이라고 말했다. 대출 한도도 줄어들 전망이다. 예를 들어 서울 강남 우성3차 34평형 아파트 상한가는 7억2500만원, 하한가는 6억4000만원 등으로 상ㆍ하한가 간 차이가 8000만원이나 된다. 은행들은 주택 대출을 늘리기 위해 상한가를 기준으로 60%까지 대출해 주는 사례가 많았다. 감독원은 이처럼 상ㆍ하한가 간에 차이가 날 때는 중간값보다 낮는 가격을 기 준으로 60%까지만 대출해 줄 것을 공식 요구했다. 이에 따라 은행들 대출 한도도 2000만~3000만원가량 줄 것으로 보인다. 은행 관계자는 ""은행들이 상한가를 기준으로 대출 한도를 설정하고 하한가와 차이만큼에 대해서는 보험사가 제공하는 보험에 가입해 위험을 줄이는 사례가 있었다""며 ""앞으로는 이 같은 편법적인 대출 한도 확대가 어렵게 됐다""고 말했 다. 집단 대출시 은행들이 실시하는 이주비 대출 한도도 줄어들게 됐다. 은행들은 그 동안 재개발단지에 집단대출을 취급하면서 이주비 대출에 대해서 는 별도로 제한 없이 대출을 실시해 왔다. 하지만 감독원은 이번에 이주비 대출도 재건축단지에 들어서는 집값 60%까지만 할 수 있도록 명시했다. 이에 따라 재건축단지 조합원들은 그만큼 은행 대출을 받을 수 있는 금액이 줄어들 가능성이 높아졌다. 감독원은 다만 대출 한도 규 제를 적용하기 시작한 2003년 6월 이전에 은행들이 대출해 준 것에 대해서는 무리하게 회수하지 말 것도 요청했다. [노영우 기자 / 윤상환 기자 / 황형규 기자] < Copyright ⓒ 매일경제. 무단전재 및 재배포 금지 >",https://n.news.naver.com/mnews/article/009/0000439657?sid=101
"신한ㆍ씨티ㆍ외환銀, 지수연동ㆍ해외투자상품 출시",2005-05-22 18:11:00,"신한은행은 국공채에 70% 이상 투자해 위험을 줄이고 안정적인 수익 달성을 목 표로 하는 '탑스(Tops) 국공채 중기 채권투자신탁'을 23일부터 판매한다. 이 상품은 정기예금 우대금리보다 0~0.8% 초과수익을 목표로 하며 국채 공사채 지역채 등 우량채권에 집중적으로 투자한다. 신한은행은 또 신탁재산 60% 이상을 유럽주식에 투자하는 장기상품 봉쥬르 유 럽배당 주식투자신탁 1호도 23일부터 판매한다. 이 상품은 해외주식 60% 이상, 국내 채권과 어음 40% 이하로 투자한다. 한국씨티은행은 중국시장에 투자하는 '차이나 블러섬 펀드'를 23일부터 다음달 3일까지 모집한다. 이 펀드는 5년 동안 모두 5번 상환 기회를 주며 설정일로부터 매년 평가시점에 HSCEI(항셍 중국기업지수)의 지수가 펀드설정 수준과 동일하거나 높으면 연 10 % 수익률로 청산한다. 만약 마지막 5년차에 조기상환조건을 충족한다면 50% 수익을 올릴 수 있다. 조 기상환 조건을 달성하지 못하면 투자원금 손실을 낼 수도 있는 점에 유의해야 한다. 외환은행은 지수연동상품인 '베이스 초이스' 정기예금에 가입한 고객이 'YES 큰 기쁨' 정기예금에 또 가입하면 연 4.5% 금리를 주는 'e-좋은 복합예금'을 2 3일부터 31일까지 판매한다. 이번에 판매하는 지수연동상품은 4종류로 크게 삼성전자 주가에 연동하는 상품 과 코스피200 지수에 연동하는 상품으로 구성돼 있으며 가입기간은 1년이다. [윤상환 기자 / 한예경 기자] < Copyright ⓒ 매일경제. 무단전재 및 재배포 금지 >",https://n.news.naver.com/mnews/article/009/0000441300?sid=101
