title,date,content,url
[부자됩시다] 삼성카드 후순위債 예상수익률 7%,2005-05-29 14:08:00,"예금이자가 너무 낮아 마땅이 돈 맡길 곳이 없다고들 하지만 재테크 전문가 사이에 서 서로 추천해주는 상품이 있다. 삼성카드 후순위 전환사채. 이 사채는 한때 액면가 60% 수준까지 떨어졌던 게 지금 은 20% 정도 프리미엄이 붙어 있다. 액면가 밑으로 떨어졌을 때 샀던 투자가들은 짭짤한 평가수익을 올리고 있다는 얘기다. 그렇다면 이 전환사채는 지금도 살 만한가. 이 사채는 2003년 6월 23일 발행됐던 것으로 만기 5년, 표면금리 2%, 만기보장수익률 9%다. 단 이 사채 보장수익률은 만기 한 달 전인 2008년 5월 23일 이전에 상장이 될 경우 5%로 낮아진다. 표면금리인 2% 이자는 액면금액에 대해 매년 말에 지급한다. 표면금리와 만기보장 수익률의 차이인 7% 추가이자는 만기일인 2008년 6월 23일에 복리로 계산 지급한다 . 이런 조건에 따라 상장이 되지 않을 경우 2008년도 이자분을 합쳐 원금의 141.8%를 지급받을 수 있다. 상장된 경우에는 원금의 116.5%만 받는다. 수익률이 급감하는 것이다. 서울 강남의 부자들을 대상으로 자산관리서비스를 해주고 있는 김선열 삼성증권 FN 아너스클럽 청담지점장은 ""은행이자에 만족하지 못하는 투자자들이 삼성카드 후순 위 전환사채를 많이 찾고 있다""며 ""상장 여부가 최대 변수이기는 하지만 그래도 은 행이자보다는 높다고 판단하고 있기 때문""이라고 말한다. 이 사채 시세는 액면금액 에 20%가 붙어있으므로 액면 1억원짜리 사채를 사려면 1억2000만원을 투자해야 한 다. 지난 5월 23일 기준으로 지금 1억2000만원을 투자할 경우 일단 2005년부터 2007년 까지 매년 말 표면이자 200만원씩을 받는다. 또 만기일인 2008년 6월 23일에는 총 1억4183만원을 쥐게 된다. 단순 연평균 수익률로 계산해보면 투자원금 1억2000만원에 대해 총 2783만원을 버 는 셈이다. 만기까지 남은 3년1개월의 투자기간에 23.2%(2783만원/1억2000만원)의 수익률를 기록하면서 연 7% 이상 수익을 얻게 되는 것이다. 물론 삼성카드가 상장될 경우 주식으로 전환하지 않고 채권으로 보유할 때 받게 되 는 금액은 1억4183만원보다 줄어든 1억1654만원이 되면서 2.12%의 수익률밖에 못 올린다. 이 사채는 일반 주식과 마찬가지로 전 증권사 계좌를 통해 거래할 수 있다 . 증권사 사이버트레이딩 시스템을 통해 채권코드 번호를 찾아 매도ㆍ매수할 수 있 다는 얘기다. 수수료는 거래대금의 0.30% 수준. [서양원 기자] < Copyright ⓒ 매일경제. 무단전재 및 재배포 금지 >",https://n.news.naver.com/mnews/article/009/0000442394?sid=101
"[은행 신용관리] 국민銀, 담보 있어도 반드시 신용평가",2005-05-11 13:32:00,"국민은행은 지난 4월 4일부터 개인ㆍ기업에 대한 대출시스템을 담보 위주에서 신용위험(리스크) 위주로 전면 개편했다. 적용되는 대출은 4월 4일 이후 일어 나는 신규 대출이나 만기가 돌아와 새로 연장하게 되는 대출이다. 새로운 시스템에서 가장 큰 특징은 개인(자영업자 포함) 신규 대출은 담보가 있거나 없거나 관계 없이 모두 신용평가를 받아야 한다는 것이다. 담보대출도 신용도가 나쁘면 대출받기 어렵게 돈을 빌리더라도 기존보다 최고 1%포인트 이 상 이자를 더 내야 한다. 결국 국민은행에서 돈을 빌리려는 고객은 신용도를 높여야 조금이라도 이자를 덜 낼 수 있다는 결론이 나온다. 국민은행이 대출 이자율 구조를 변경시킨 것은 2007년 국내에 도입되는 바젤(B asel)II 요건 때문이다. 바젤II란 대출시 신용도에 따라 쌓아야 할 충당금이 달라지는 것이다. 새로운 체계에서는 신용도를 높이는 게 가장 중요하다. 은행 가운데 국제결제은행(BIS)이 권고하는 바젤II 요건에 맞춰 대출시스템을 바꾼 것은 국민은행이 처음이다. 국민은행이 바꾸는 시스템은 개인여신, 개인형 소호(자영업자) 대출, 기업여신 , 여신 사후관리 등 크게 4가지다. 개인여신 시스템은 신용평가도 반영을 모든 대출로 확대한 게 특징이다. 국민은행은 개인 신용대출(자영업자 포함)은 최우량 고객에 적용되는 금리를 7 .9%에서 7.0%로 낮췄다. 최하위 등급에 적용되는 금리는 연 13.4%에서 연 12.9 5%로 낮아졌다. 국민은행은 현재 500만건이 넘는 개인대출이 있으면 이 가운데 200만건가량이 신용대출이고 나머지는 담보대출로 분류된다. 모든 개인 담보대출에도 개인 신용평가가 반영되도록 바뀌었다. 국민은행은 모 든 신용대출에 대해서는 지난해 9월부터 신용도 평가를 해 왔으나 담보대출에 대해서는 개인 신용도를 반영하지 않아 금리 차이가 거의 없었다. 하지만 앞으로는 달라진다. 물론 아파트를 담보로 한 개인대출은 저당권 설정 이 대출금액 130%에 달하고 담보가치가 충분하면 개인신용도에 따른 금리차는 0.1%포인트 정도로 미미하다. 반면에 지급보증서를 담보로 제출하거나 담보가 액이 대출금 85~90% 정도 되는 담보대출은 금리를 1% 이상 더 높게 적용받는다 . 국민은행은 대출을 끼고 부동산을 사고팔 때도 개인신용도가 나쁘면 대출해 주 지 않는다. 예컨대 채무 인수를 통해 집을 살 때 신용불량자가 아니면서 신용 도가 나쁠 때는 명의변경을 해 주지 않는다는 것이다. 국민은행 외에 다른 은 행, 카드사, 상호저축은행 등 거래 건수나 금액, 연체 여부 등도 감안해 승인 여부를 결정한다는 얘기다. 적용되는 사례는 100명 중 1~2명에 불과하지만 실제로 신용도가 나쁜 고객은 불이익을 받을 수 있으므로 대출을 끼고 부동산 거래를 할 때는 은행에 사전문 의하는 게 좋다. 국민은행은 기업여신 시스템도 개편해 부도율과 예상 회수율 기준에서 바젤II 권고안인 부도율과 은행 예상 손실률로 바꿨다. 이렇게 되면 기업대출 가운데 신용대출은 0.1~0.2%포인트 떨어지는 반면 담보대출은 0.1~0. 2%포인트가량 금리가 오르게 됐다. [김상민 기자] < Copyright ⓒ 매일경제. 무단전재 및 재배포 금지 >",https://n.news.naver.com/mnews/article/009/0000439512?sid=101
"불법 자금모집, 고수익 확정지급 내세우면 의심",2005-05-12 16:26:00,"10년 동안 납입한 적금 4000만원을 탄 주부 박옥진 씨(가명ㆍ44). 그는 은행 금리가 워낙 낮아 그 돈을 어떻게 굴려야 할까 고민중이었다. 여러 가지 생각을 하던 그는 생활정보지를 보다가 눈이 번쩍 뜨였다. 연 100% 이상 고수익을 보장한다는 A업체 광고를 발견한 것이다. A업체는 투자자가 건 강침대를 구입해 자사에 임대해 주면 이를 모텔에 재임대하는 방식으로 고수익 을 낼 수 있다는 설명까지 했다. 건강침대를 구입하기 위해 1계좌에 400만원씩 10계좌(4000만원)에 투자하면 2 년 동안 매월 500만원씩 총 1억2000만원을 지급한다는 것이다. 정부 '등록업체'라는 문구를 믿고 박씨는 선뜻 10계좌에 투자했다. 투자 초기 에는 약속대로 500만원이 입금됐다. 하지만 두 달이 지난 후부터 입금은커녕 A 업체에 연락조차 되지 않았다. 사기를 당한 것이다. 박씨처럼 유사 금융업체에 사기를 당한 사람이 늘고 피해 규모도 커지자 금융 감독원이 대대적인 단속에 나섰다. 금감원은 12일 금융질서 교란사범에 대한 집중조사를 벌인 결과 불법 자금모집 업체 24개와 고금리 수취, 신용카드 할인 등 불법 행위 혐의가 있는 사금융 업 체 354개를 적발해 경찰청에 통보했다고 밝혔다. 금감원에 따르면 불법 자금모집 업체 중에는 박씨 사례처럼 구입 후 임대 방식 으로 투자자를 현혹하는 곳이 많았다. 서울에 있는 M업체는 무인시스템과 건강 침대 구입ㆍ임대 방식을 미끼로 자금을 모집했다. 그러나 현행법상 투자자에게 원금 전액 또는 이를 초과하는 금액 지급을 약정 하고 자금을 모집하는 것이 금지돼 있다. 금감원 관계자는 ""이런 방식으로 자금을 모으는 것 자체가 불법인 데다 이런 업체 중 상당수는 결국 돈을 가지고 사라지는 사기극을 저지르곤 한다""며 주의 를 당부했다. 이번 단속에서는 월 5.5%(연 66%)로 제한된 법정이율을 초과한 고금리를 받아 내거나 무등록 대부 행위를 하는 등 불법 혐의가 있는 사금융 업체가 대거 적 발됐다. 올해 들어 지난달까지 이런 불법 혐의로 적발된 업체는 총 542개로 전년 동기 보다 380개나 늘었다. 서민을 울리는 불법 사금융이 활개를 치고 있는 것이다. 적발된 불법 사금융은 나름대로 몇 가지 특징이 있어 투자자들이 조금만 주의 를 기울이면 예방할 수 있다. 금감원에 따르면 △광고에 유선 전화번호 대신 휴대폰 번호를 적거나 △생활정 보지 등에 고수익 보장, 돈 놓을 분 구함 등 광고를 내는 곳은 주의해야 한다. 유명 연예인, 정ㆍ관계 인사와 친분 등을 내세우는 곳도 의심스럽다. 정부 '등록' 또는 '허가법인'임을 지나치게 강조하는 곳도 조심해야 한다. 사 업자 등록, 대부업 등록, 다단계업 등록 등 필수 등록사항을 가지고 정부가 마 치 사업 적법성이나 자금모집을 허용하는 것처럼 선전하는 곳이 적지 않기 때 문이다. 아울러 주부 등 투자 모집책을 동원해 다단계 판매 방식으로 자금을 모집하는 곳도 피해야 한다. 금감원은 ""휴대폰으로 개인정보를 알려달라는 곳과는 절대 상담하지 말고 고금 리 등을 요구할 때는 사금융피해신고센터로 신고해 도움을 받을 필요가 있다"" 고 권고했다. [황형규 기자] < Copyright ⓒ 매일경제. 무단전재 및 재배포 금지 >",https://n.news.naver.com/mnews/article/009/0000439739?sid=101
[증권] 배당많고 이익 좋아진 종목 '찜',2005-05-15 13:17:00,"종합지수가 900 초반대에서 박스권을 형성하고 있는 등 다소 불안한 모습을 보 이고 있다. 증권 전문가들도 잘 고른 고배당 우량주는 배당 수익과 함께 주가 상승에 따른 시세차익까지 '두 마리 토끼'를 잡을 수 있는 종목이라는 데 입을 모으고 있다. ◆ 저금리 환경에 고배당주 투자 어떨까＝시장에서는 다음달 중간배당 시즌이 다가오면서 지수 조정으로 하락폭이 확대되고 있는 배당종목에 주목할 필요가 있다는 분석이 잇따르고 있다. 대한투자증권은 중간배당을 앞둔 배당주 유망 종목으로 KT LG석유화학 SK텔레콤 등을 추천했다. 우리투자증권은 ""KT는 올해에도 중간배당 1000원을 포함해 주당 3000원의 배당 금을 거의 확정한 상태로 배당수익률은 7.7% 선""이라고 추천했다. 대신증권도 KT 외에 삼성전자 KCC 한국가스공사 등을 유망 중간배당주로 꼽았 다. 삼성전자는 주당 5000원, KCC는 주당 1000원, 한국가스공사는 주당 450원 을 중간배당할 것으로 예상했다. 이와 함께 대신증권은 코스피200 종목 가운데 배당수익률이 3% 이상, 매출과 영업익 증가율이 10% 이상, 자기자본이익률이 15% 이상, 부채비율이 200% 이하 종목 기준으로 에쓰오일 SK LG석유화학 한라공조 동국제강 동양기전 대림산업 등 7개 종목에 대해 관심을 가지라고 분석했다. 삼성증권도 주가가 쌀 때 배당투자를 하면 그만큼 배당수익률이 높아진다며 LG 석유화학 에쓰오일 KT LS산전 세종공업 등을 배당 투자 유망 종목으로 선정했 다. 증권사들이 공통으로 추천한 LG석유화학과 에쓰오일은 각각 연중 고점 대비 17 %, 13% 가까이 하락한 반면 배당수익률은 7.3%, 6.41%에 달하고 있다. 김용균 대신증권 연구원은 ""이제는 체계적인 배당 투자전략이 필요한 때""라며 ""최근 현금배당 증가와 자사주 매입 등 배당과 유사한 효과로 시중금리 이상의 배당수익을 올린 종목들이 바람직한 투자 대상이 될 수 있다""고 말했다. ◆ 고배당주 주가 성적도 '굿'＝2004사업연도에 높은 배당을 실시한 종목들의 주가가 크게 오르는 것으로 나타났다. 결국 지난해 말 전에 이들 종목을 사두고 현재까지 보유하고 있는 투자자라면 배당 수익에다 시세차익까지 짭짤한 수익을 올릴 수 있었음을 의미한다. 실제로 증권선물거래소에 따르면 2004사업연도 시가배당률(주당 배당금/연말 종가)이 10%를 넘는 유가증권시장 상장법인의 주가는 지난해 말보다 지난 11일 종가 기준으로 평균 51.33%나 올랐다. 12월 결산법인 가운데 최근 3년 연속 현금배당을 한 261개사가 분석 대상이다. 같은 기간 종합주가지수 상승률 3.07%를 크게 웃도는 수준이다. 시가배당률로 10% 이상 배당을 한 상장법인은 캠브리지 한국쉘석유 영풍제지 부산산업 휴스틸 모토닉 덕양산업 등 7곳이다. ABN암로증권은 지난 13일 한국 전략보고서에서 고배당주에 대한 선호가 전통적 으로 시장 대비 초과 수익을 냈다고 강조했다. ABN암로는 대형주 가운데 배당수익률이 높은 종목으로 에쓰오일 KT&G KT 등을 꼽았다. 중소형 배당주 중에서는 3월 결산법인인 보험주, 특히 동부화재와 동 양화재의 투자가 유리하고 율촌화학도 긍정적이라고 밝혔다. [홍종성 기자] < Copyright ⓒ 매일경제. 무단전재 및 재배포 금지 >",https://n.news.naver.com/mnews/article/009/0000440066?sid=101
[사설] 건교부 계속 몸만 사릴 건가,2005-05-29 18:17:00,"요즘 온나라를 시끄럽게 만들고 있는 러시아 유전이나 행담도 개발을 둘러싼 쌍둥 이 의혹은 모두 건설교통부 소관 사안들이다. 통화운영 정책의 근간인 금리 문제마 저 흔들리게 하는 부동산 투기 문제나 서민생활과 밀접한 관련을 지닌 임대주택 부 실 관리 등도 역시 건교부가 주무(主務)를 맡고 있다. 뿐만 아니라 행정복합중심도 시, 공기업 지방 이전 등 안 걸리는 문제가 없을 정도다. 이 같은 수많은 업무를 한 부처에서 관장하기란 쉽지 않겠지만 건교부가 좀더 선제 적으로 용의주도하게 관장하고 처리했더라면 오늘날과 같이 나라를 벌집 쑤셔놓은 듯 만들지 않았을 것이란 생각이 든다. 그렇다면 건교부는 시대적 변화에 걸맞은 사고 전환이 필요하며 좀더 능동적인 자세로 일해줄 것을 촉구하지 않을 수 없다. 쌍둥이 개발 의혹이 터졌을 당시만 해도 건교부측은 ""산하 기관의 실무책임자 전결 사항""이라며 모르쇠로 일관했다. 그러다가 차관이 구속 수감되는 사태로 비화돼 국 민 신뢰도는 땅바닥에 떨어졌건만 아직까지 부처 차원의 사과나 해명은 없었다. 행담도 사태도 국장급이 장관을 대신해 추천서를 써주는 등 월권행위가 있었음에도 매스컴에서 제기되는 의혹에 땜질식 변명을 늘어놓기 바쁜 실정이다. 이래서야 어 떻게 큰일을 믿고 맡길 수 있을 것인가. 부동산 문제만 해도 그렇다. 주택가격 안정을 참여정부의 가장 큰 과제로 채택했건 만 결과는 집값을 가장 많이 올린 정부가 되고 말았다. 임대주택 비중은 선진국의 경우 대개 15% 수준인 데도 국내는 고작 3%대에 머물고 있으며 그나마 영세 건설업 자가 전담해 입주 서민이 돈을 떼인 사고가 빈발하게 터지고 있다. 진작부터 우량 건설업체로 하여금 의무적으로 일정비율 이상 임대주택 사업 참여를 의무화해 많은 양을 공급했더라면 오늘날과 같은 집값 폭등은 막을 수 있었을 것이 다. 지난주 재정경제부는 부총리 이하 3급 이상 간부들이 혁신 워크숍을 갖고 자아비판 식 토론을 개최했다고 한다. 행정자치부의 경우 팀제를 도입해 공직사회에 경쟁원 리를 도입하는 진화를 시도하고 있다. 우리는 이 같은 자기성찰과 환골탈태가 정작 필요한 부처는 바로 건교부라고 본다. 국민 신뢰를 다시 얻을 수 있는 묘안을 강구 해 실천에 옮길 것을 거듭 촉구한다. < Copyright ⓒ 매일경제. 무단전재 및 재배포 금지 >",https://n.news.naver.com/mnews/article/009/0000442516?sid=110
미국 경제지표 순항 관건,2005-05-08 17:47:00,"미국 경제에 대한 긍정적인 신호가 언제까지 지속될 수 있을지가 이번주 미국 증시 향방을 좌우할 것으로 보인다. 또 이번주 발표 예정인 경제협력개발기구(OECD) 경기선행지수도 중요 변수가 될 전망이다. 지난주에는 미국 경제에 대한 긍정적인 신호가 잇따랐다. 미국 연방공개시장위원회(FOMC) 회의에서 시장 예상대로 연방기금 금리가 0.25 %포인트 인상돼 이를 둘러싼 불확실성이 해소됐다. 또 지난 4월 미국 비농업부문 고용 창출이 예상치를 대폭 웃돈 것도 긍정적인 요인으로 평가됐다. 4월 비농업부문에서 신규 일자리는 월가 전문가 예상치(17 만∼19만명)를 훨씬 넘는 27만4000명을 기록했다. 이러한 재료는 그 동안 부상했던 미국 경제 불확실성을 해소하는 데 일단 도움 이 됐지만 예상을 벗어난 고용 증가로 미국 연방준비제도이사회(FRB) 금리인상 행보가 빨라질 수 있다는 또 다른 불안감이 고개를 들었다. 실제로 고용지표가 발표된 지난 6일(현지시간) 다우존스지수(0.05%)와 나스닥 지수(0.28%) 상승폭은 제한됐으며, 스탠더드 앤드 푸어스(S&P) 500지수는 0.11 % 하락세를 보였다. 월가 전문가들은 앞으로도 금리 문제가 투자자 사이에 가 장 큰 관심사 가운데 하나가 될 것이라고 전망했다. 아울러 이번주에도 미국 증시에 영향을 줄 중요한 경제지표가 발표될 예정이어 서 귀추가 주목된다. 무엇보다 11일 발표될 예정인 미국 3월 무역수지가 가장 관심을 끌 것으로 관 측된다. 또 12일 발표될 △신규 실업수당 청구건수 △4월 소매판매 실적과 13일 발표될 △미시간대 5월 소비자태도지수 △4월 수입물가지수 등도 이번주 미국 증시에 영향을 줄 주요 변수로 작용할 전망이다. 한편 11일 발표될 3월 OECD 경기선행지수는 미국 증시를 비롯한 글로벌 증시에 큰 영향을 미칠 것으로 보인다. 지난달 초 발표된 2월 OECD 경기선행지수는 넉 달 만에 하락세로 돌아서면서 글로벌 경기 둔화에 대한 걱정을 촉발하는 데 직접적인 계기로 작용한 바 있다 . OECD 경기선행지수는 미국 등 OECD 국가 산업생산을 3~6개월 정도 선행하는 움직임을 나타낸다. 연초 세계 각국이 나타냈던 부진한 움직임을 고려하면 3월 경기선행지수가 또 한 번 단기적인 충격으로 이어질 수 있다는 전망도 제기되 고 있다. [장용승 기자] < Copyright ⓒ 매일경제. 무단전재 및 재배포 금지 >",https://n.news.naver.com/mnews/article/009/0000438839?sid=101
경기회복 더딘데 일부지표 과열,2005-05-18 17:08:00,"경기가 바닥에서 빠져나오지 못하는 상황에서 금융시장을 중심으로 일부 이상 과열 지표들이 속출하고 있다. 때아닌 '과열 논쟁'마저 벌어지고 있다. 전문가들은 과열양상만큼은 조기에 진화시켜야 한다는 의견과 섣부른 정부 개 입이 오히려 애써 살려내고 있는 경기불씨를 꺼버릴 수 있다는 의견으로 양분 되고 있기 때문이다. 실제로 최근 일부 경제지표들을 보면 과연 경기침체 국면이라고 봐야 하는지 의심스런 대목이 많다. 최근 3개월 동안 가계부문 은행대출이 6조원 가까이 급증했다. 한국은행이 집 계한 은행권 가계대출의 경우 1월만 해도 전월 대비 174억원가량 줄었지만 2월 부터 가파른 증가세를 보이고 있다.특히 4월에는 무려 3조1058억원이나 급증했 다. 월간 증가폭만 놓고 보면 2003년 10월(4조2594억원) 이래 최고치다. 18일 발표된 보험사 약관대출이나 부동산담보대출도 급증세를 보이긴 마찬가지 다. 신용카드 사용액 증가세도 두드러지고 있다. 지난해 3분기부터 조금씩 증가세 로 돌아서기 시작한 신용카드 사용액은 지난 연말부터 두 자릿수로 늘어나더니 지난 4월에는 18.3%나 급증했다. 부동산시장도 일부 지역을 중심으로 과열양상을 보이고 있다. 지난해 6만4000여 건 수준이던 아파트 월평균 거래건수가 올 들어 조금씩 늘더 니 3월에는 무려 9만건으로 급증했다. 토지 거래건수도 일부 지역에서 거래가 크게 늘면서 3월에는 27만9000여 건에 달했다. 지난해는 월평균 21만8000여 건 수준이었다. 모 국책연구소 거시 담당 연구위원은 ""경제규모가 커지면 가계부채 규모가 늘 어나는 것은 당연하다""면서 ""걱정해야 하는 것은 금융권의 과당경쟁""이라고 강 조했다. 최근 윤증현 금융감독위원장이 ""신용카드사와 자산운용사 등 금융권 부문별로 과당경쟁이 있는지 실태를 파악해 조속히 대책을 마련하라""고 지시했을 정도다 . 은행간 금리인하 경쟁까지 촉발했던 주택담보대출이나 적립식펀드에 대한 경 고의 목소리도 조금씩 나오고 있는 상황이다. 하지만 업계에선 경기회복에 앞서 고객들을 상대로 본격적인 마케팅을 시작하 는 시기라면 당국에서 나설 정도는 아니라고 볼멘소리를 하고 있다. 자칫 정부 가 회복 움직임에 찬물을 끼얹을 수 있다는 지적이다. 예를 들어 일부지역의 부동산투기를 전국적인 현상인 것처럼 전 부처가 나서는 식의 과도한 정책은 불필요하다는 주문도 나왔다. 오히려 마땅한 투자처를 찾지 못하고 맴돌고 있는 시중자금이 여전히 많다는 것을 의미한다는 얘기다. 정부는 여전히 막혀 있는 돈흐름을 뚫어주는 역할을 맡아야 한다는 주장이다. 아직은 경제주체들이 경기회복에 대한 확신을 갖지 못하고 있는 상태여서 안정 적 수익을 기대하기보다는 오히려 투기적인 성향을 드러내는 단계로 봐야 한다 는 분석도 제기됐다. [송성훈 기자] < Copyright ⓒ 매일경제. 무단전재 및 재배포 금지 >",https://n.news.naver.com/mnews/article/009/0000440762?sid=101
