title,date,content,url
[표] 주요시세,2005-05-18 19:26:00,"======================================== 주가 ---------------------------------------- 종합주가      930.36           (▲ 3.20) 코스닥        436.55           (▲ 2.03) 뉴욕다우   10,331.88          (▲ 79.59) 나스닥      2,004.15           (▲ 9.72) S&P500      1,173.80           (▲ 8.11) 홍콩지수   13,627.01          (▼ 40.02) 대만지수    5,890.83           (▼ 3.18) 닛케이     10,835.41          (▲ 10.02) ---------------------------------------- 환율 ---------------------------------------- 1달러     1,005.20원           (▲ 0.70) 107.42엔          (▲  0.24) 100엔       932.47원          (▼  5.00) 1유로     1.2629달러          (보　　합) 1,266.70원           (▼ 2.25) ---------------------------------------- 금리 ---------------------------------------- 국고채(3년)    3.67%          (▼  0.02) 회사채(AA-)    4.08%          (▼  0.02) (BBB-)   8.07%          (▼  0.02) CD(91일)       3.51%          (보　　합) 콜(1일)        3.29%          (▲  0.01) ======================================== 다우존스, 나스닥, S&P500은 전날 기준. 홍콩, 대만지수는 당일 기준. 엔ㆍ달러, 달러ㆍ유로는 도쿄 오후 5시. 원ㆍ달러 환율은 종가. < Copyright ⓒ 매일경제. 무단전재 및 재배포 금지 >",https://n.news.naver.com/mnews/article/009/0000440796?sid=101
"외국계증권사 북핵 잇단 경고, 국내증시 의외로 '무덤덤'",2005-05-13 07:53:00,"'북핵 리스크'가 증시를 짓누를 것인가. 시장 관심이 온통 최근 고조되고 있는 북핵 리스크에 쏠리고 있다. 최근 미국 정부 고위관리가 북핵과 관련해 ""북한 이 핵실험을 하면 한국 주가는 50% 이상 폭락할 것""이라고 밝혀 북핵 리스크가 잠복성 악재로 부각되고 있다. 최근 원화 강세 등 여파로 국내 기업의 실적 악화가 뚜렷한 데다 시장 체력이 악화된 상태라서 시장이 과연 북핵 리스크를 견뎌낼 수 있느냐에 관심이 모아 진다. ◆ 북핵 리스크 경고 메시지 '솔솔'＝북핵 리스크 여파로 주가가 급락할 수 있 다는 시장의 경고 메시지도 잇따르고 있다. 인도 파키스탄 등 과거 핵실험 국가들의 당시 주가 움직임도 이 같은 경고 메 시지를 뒷받침하고 있다. 인도는 핵실험 5개월 후인 지난 98년 10월 중순까지 30%가량 주가가 하락한 뒤에야 반등에 나섰지만 99년 5월에 비로소 종전 주가 수준을 회복했다. 핵실험 이후 불과 두 달 만에 46%나 하락했던 파키스탄 주가도 1년7개월이 지 난 99년 12월 중순에 종전 수준으로 돌아왔다. 윤세욱 메리츠증권 리서치센터장은 ""미국 중국 일본 러시아 등 강대국이 인접 해 있는 한국에서 핵실험이 강행되면 주가에 큰 충격이 올 수밖에 없다""고 분 석했다. 씨티그룹 스미스바니증권은 '한국시장 전략보고서'에서 북핵 문제가 과거 10년 간 사상 최악의 상황에 놓였다고 밝혔다. 대니얼 유 이사는 ""북핵 리스크로 인해 한두 달 사이에 증시가 큰 폭 조정을 받을 것""이라며 ""주가가 기술적 반등으로 강세를 보일 때 적극적으로 차익을 실현하라""고 권고했다. 향후 3~6개월 간 지수 목표치도 795로 유지했다. 이남우 메릴린치 리서치센터장은 ""향후 북핵 리스크가 계속해서 고조되고 이 경우를 대비해 지수선물 풋옵션을 매수해 하락 위기를 방어하는 투자전략이 필 요하다""고 밝혔다. 조익재 CJ투자증권 리서치센터장은 ""지난 2월 북한의 핵보유 선언 당시 주가가 큰 영향을 받지 않았던 것처럼 증시 체력이 좋을 때는 그냥 넘어갈 수 있겠지 만 지금은 확인되지 않은 사실에도 쉽게 주가가 흔들리고 있다""며 ""상황이 이 렇다보니 실제 북핵 위험이 가시화하면 증시에 예상되는 충격은 상당히 클 것"" 이라고 말했다. ◆ 최악 상황까지 치닫기엔 '글쎄'＝국내 증시에 메가톤급 충격을 줄 수 있는 최악의 상황으로 시장은 북한이 실제로 핵실험에 나설 경우를 꼽고 있다. 이 경우 미국은 대북 봉쇄나 정밀 타격 등에 나설 것이고 북한과 미국은 전쟁 국면에 돌입해 동아시아를 중심으로 한 세계 금융시장에 충격을 줄 수 있기 때 문이다. 유승민 삼성증권 연구원은 ""북한이 '레드라인'을 넘으면 최악의 상황으로까지 치달을 수 있다""며 ""이렇게 되면 외국인 자금의 이탈이 가시화되고 금융시장 전반이 '공황'에 빠질 수 있으며 최악 상황에서는 투자 전망과 투자전략 수립 자체가 어렵다""고 진단했다. 시장은 이 같은 최악 상황으로까지 악화될 가능성은 낮은 것으로 판단하고 있 다. 메릴린치증권은 ""북한이 중국의 뜻을 거스르고 실제 핵실험을 감행할 가능성은 20∼30% 선""이라고 밝혔다. 함성식 대신증권 연구원도 ""북핵 문제가 예측 가능 범위에서 다소 벗어나 있지 만 외평채 금리 안정과 외국인 순매수, 단기적 환율 안정 등으로 볼 때 통제 가능한 범위에 있다""고 말했다. 특히 후진타오 중국 국가주석의 북한 방북이 연기되고 있지만 만약 방북 일정 이 확정되면 북핵 리스크에 따른 악재는 점차 사라질 것이라고 강조했다. 유승민 연구원도 ""앞으로 북핵 리스크는 이달이나 다음달중 진행되는 협상이 긍정적으로 전개돼 미국과 북한이 모두 양보하는 '낙관적 해결'이나 북한의 벼 랑끝 전술이 지속되고 미국의 다자간 압박이 지속되는 '교착국면 지속'으로 갈 가능성이 높다""고말했다. 한편 박병원 재정경제부 차관보는 이날 북한 핵문제를 둘러싼 긴장 고조가 외 국인 투자에 별다른 영향을 주지 않고 있다고 밝혔다. 이는 북한 핵문제가 만 성화되면서 시장에 이미 반영됐고 한국 경제에 대한 대외 신뢰도 역시 높아졌 기 때문이라고 설명했다. [장용승 기자 / 홍종성 기자] < Copyright ⓒ 매일경제. 무단전재 및 재배포 금지 >",https://n.news.naver.com/mnews/article/009/0000439859?sid=101
"[은행 신용관리] 제일銀, 2~3일 걸리는 대출을 즉시 해줘",2005-05-11 13:32:00,"제일은행 신용여신전략의 기본원칙은 차주(돈 빌리는 사람)의 상환능력에 맞게 대출을 해주고 지속적인 관리를 통해 부실을 최소화하는 것이다. 이런 원칙에 따라 신용평가시스템을 갖추고 차주의 소득, 기존에 받고 있는 신 용대출, 개인의 여러 재무상황 등을 시스템에 반영해 이 결과를 토대로 대출을 취급한다. 대출을 취급할 때는 만 20세 이상 소득이 있는 사람 중 신용평가시스템에 의해 신용평가등급에 따라 대출승인 여부, 대출가능 한도, 금리 등을 결정한다. 대 출한도는 최저 70만원에서 최고 5000만원까지로 그 범위가 매우 넓다. 제일은행의 대표적인 신용대출 상품은 '제일빠른대출'이다. 이 대출은 대출신청 후 바로 대출을 받는 방식이 적용된다. 종전 일반적인 신 용대출은 대출절차를 거쳐 대출금이 나오기까지 2~3일이 걸리는 반면 이 대출 은 이름에 걸맞게 그 자리에서 즉시 대출이 가능하도록 절차가 진행된다. 상담, 심사, 대출실행까지의 과정을 신속히 처리할 수 있도록 대출처리 시스템 을 업그레이드하였을 뿐만 아니라 대출절차를 간소화해 고객에게 시간 절약 혜 택을 주는 게 가장 큰 장점이다. 또 이 상품 출시를 기념하여 기본적인 금리를 0.4% 인하했고 급여이체시 추가 로 0.2%, 대출시점부터 3개월 간 최고 1.5%까지 금리를 할인해주고 있어 최저 연 5.78%에도 대출을 받을 수 있다. 제일은행 관계자는 ""영업점에 근무하면서 원칙없는 대출은 항상 부실로 이어지 는 것을 많이 봐 왔다""며 ""시장원칙에 맞지 않는 정책은 또 다른 부실을 양성 할 뿐 아니라 신용사회를 만들어 가는 데 오히려 걸림돌이 될 것""이라고 말했 다. < Copyright ⓒ 매일경제. 무단전재 및 재배포 금지 >",https://n.news.naver.com/mnews/article/009/0000439514?sid=101
국민銀 개별주 연동 상품 출시,2005-05-24 15:02:00,"'삼성전자 주가 오르면 추가금리' 국민은행은 만기해지시 원금이 100% 보장되면서 삼성전자, 포스코, 현대자동차 주가 변동에 따라 일반 정기예금금리 이상의 수익이 가능한 'KB리더스정기예금 개별주가연동(1호)'를 24일부터 오는 31일까지 한시판매한다. '삼성전자 연동형'과 'POSCO 연동형'은 이들 회사의 주가가 기준가격 대비 30% 이상 상승한 적이 한번이라도 있으면 이후 주가변동과 관계없이 연 5.0%로 금 리를 확정해준다. 그렇지 않은 경우에는 만기시 주가상승률에 따라 최고 연 14 .99%까지 수익을 기대할 수 있다. 이번에 판매되는 상품은 KOSPI200 지수의 변동성이 감소함에 따라 상대적으로 성장가능성이 높은 한국의 대표적인 우량주에 연동해 고수익을 기대할 수 있도 록 설계된 게 특징이다. < Copyright ⓒ 매일경제. 무단전재 및 재배포 금지 >",https://n.news.naver.com/mnews/article/009/0000441670?sid=101
"우리銀, 中企근로자만을 위한 신용대출",2005-05-27 07:32:00,"우량 중소기업 근로자들이 신용대출을 받기 쉬워진다. 우리은행은 6월부터 우량 중소기업 직원을 대상으로 주민등록증만 갖고 오면 즉시 대출해 주는 신용대출 상품을 판매하기로 했다. 우리은행 자체 기업등급으로 5등급 이상에 해당하는 2000여 개 우수 중소기업 임직원이면 누구든 대출받을 수 있다. 사립초ㆍ중ㆍ고등학교 교직원들도 여기 에 포함된다. 우리은행이 해당 업체와 미리 전산작업을 해 놓았기 때문에 재직증명서 없이도 지점에서 주민등록번호만 대면 대출이 가능하다는 얘기다. 대출한도는 기본적으로 연소득 200%까지 가능하지만 5000만원까지는 심사 없이 즉시 대출받을 수 있다. 그 이상이면 본인 상환 능력에 대한 신용평가를 받아 야 한다. 특히 7월부터는 즉시 대출 한도가 7000만원으로 증액될 예정이다. 그 동안 은행들은 대출 문턱을 많이 낮췄지만 중소기업 근로자들이 신용대출을 받기 위해서는 여전히 재직증명서, 근로소득원천징수 영수증 등 각종 서류를 겸비해야 했다. 대기업 근로자나 고소득 자영업자들에 비해 금리 부담도 상당 했다. 우리은행이 이 같은 상황에서 신용도가 있는 기업으로 대출 저변을 확대하기 위해 파격적인 중소기업 직장인 신용대출을 내놓기로 했다. 현재 우리은행이 예상하는 평균 대출금리는 연 7%대로 저렴한 편이다. 최근 시 중은행들이 신용대출 최저 금리로 내세우고 있는 것이 7%대 수준이기 때문이다 . 마이너스통장 대출을 받을 때 별도로 수수료가 없는 것도 특징이다. 마이너스통장으로 신용대출을 받을 때 한도를 어느 정도 설정해 두고 이를 사 용하지 않으면 그에 대한 벌금 성격으로 수수료를 내는 게 일반적이다. 하지만 이번 우수 중소기업 근로자 대상 신용대출 상품은 이 같은 수수료도 받 지 않는다는 것이다. 일단 대출받는 사람이 일하고 있는 기업에 대한 신뢰를 어느 정도 확보했기 때 문에 근로자에게는 그만큼 저리로 대출해 줄 수 있다는 게 은행측 판단이다. 또 기업 고객인 우수 중소기업과 개인 고객인 임직원을 한 번에 잡을 수 있기 때문에 그만큼 확실한 수익원을 대거 확보할 수 있다는 판단도 작용한 것으로 보인다. 우리은행 관계자는 ""앞으로는 우리은행 홈페이지에 주민등록번호만 입력하면 인터넷으로도 대출이 가능하도록 할 방침""이라며 ""우수 고객들을 확보하기 위 해 금리와 수수료 측면에서 파격적인 혜택을 줄 예정""이라고 밝혔다. [한예경 기자] < Copyright ⓒ 매일경제. 무단전재 및 재배포 금지 >",https://n.news.naver.com/mnews/article/009/0000368735?sid=101
[표] 주요시세,2005-05-06 18:08:00,"======================================== 주가 ---------------------------------------- 종합주가      940.85          (▲ 11.50) 코스닥        433.29           (▲ 3.88) 뉴욕다우   10,340.38          (▼ 44.26) 나스닥      1,961.80           (▼ 0.43) S&P500      1,172.63           (▼ 3.02) 홍콩지수   14,033.96          (▼ 27.74) 대만지수    5,967.96          (▲ 40.46) 닛케이     11,192.17         (▲ 190.06) ---------------------------------------- 환율 ---------------------------------------- 1달러       998.00원           (▼ 1.80) 104.75엔          (▲  0.39) 100엔       954.35원          (▼  0.57) 1유로     1.2947달러        (▼  0.0028) 1,292.51원           (▼ 3.23) ---------------------------------------- 금리 ---------------------------------------- 국고채(3년)    3.77%          (보　　합) 회사채(AA-)    4.18%          (▲  0.01) (BBB-)   8.20%          (보　　합) CD(91일)       3.49%          (보　　합) 콜(1일)        3.31%          (▲  0.11) 미국국채(10년) 4.16%          (▼  0.03) 일본국채(10년) 1.22%          (▼  0.02) ---------------------------------------- 원자재 ---------------------------------------- 유가(WTI)    50.83달러        (▲  0.70) 금1돈(소매)   69,000원        (보　　합) 반도체(256M)  2.38달러        (보　　합) ======================================== 다우존스, 나스닥, WTI(선물), S&P500은 전날 기준. 홍콩, 대만지수는 당일 기준. 엔ㆍ달러, 달러ㆍ유로는 도쿄 오후 5시 기준. 원ㆍ달러 환율은 종가. < Copyright ⓒ 매일경제. 무단전재 및 재배포 금지 >",https://n.news.naver.com/mnews/article/009/0000438696?sid=101
기업은행 '기술력 우수기업 대출' 출시,2005-05-18 15:02:00,"기업은행은 기술력과 성장잠재력을 갖고 있지만 자금난을 겪고 있는 중소기업 전용 대출 상품인 '기술력 우수기업 대출'을 출시했다고 18일 밝혔다. 이 대출은 기술신용보증기금이 발급하는 '기술평가인증서'를 근거로 최대 10억 원까지 받을 수 있으며 금리는 연 5~6% 수준이다. 기업은행 관계자는 ""기술력은 있지만 담보가 부족한 중소기업들의 사업 성공에 실질적인 도움이 될 것으로 기대한다""고 밝혔다. 대출을 받기 위해서는 기업은행 전국 영업점에 기술평가인증을 신청하고 대출 절차를 상담하면 된다. < Copyright ⓒ 매일경제. 무단전재 및 재배포 금지 >",https://n.news.naver.com/mnews/article/009/0000440666?sid=101
"유지창 産銀총재 ""대우조선 등 3社국내 PEF에 매각 바람직""",2005-05-02 07:38:00,"LG카드가 내년 3월까지는 매각될 전망이다. 유지창 산업은행 총재는 지난달 29일 출입기자단 세미나에서 ""채권단이 LG카드 를 계속 보유하는 것은 옳지 않다""며 ""'LG' 브랜드를 내년 3월까지 쓸 수 있다 는 점을 고려할 때 이때까지는 팔아야 한다는 생각""이라며 내년 3월까지 매각 할 계획임을 강력히 시사했다. 유 총재는 이어 ""매각은 시장상황에 따라 결정되겠지만 50%를 먼저 팔고 나머 지는 나중에 팔 수도 있다""며 ""채권단과 LG그룹이 LG카드에 투자한 돈이 4조50 00억원인데 원전(본전) 이상은 찾아주도록 하겠다""고 덧붙였다. 이 밖에 산업 은행이 지분을 보유하고 있는 기업들의 매각 계획과 관련해서는 ""대우조선해양 은 덩치가 너무 커 국내외 인수자를 찾기 힘든 상태""라며 ""국내 사모투자회사( PEF)들이 공동으로 사는 방법이 좋을 것 같다""고 밝혔다. 유 총재는 또 ""하이닉스와 현대건설 매각은 산업정책적 의미와 기술의 해외유 출 문제 등을 고려할 때 국내 투자자에게 매각하는 것이 바람직하다는 생각""이 라며 해외매각에 대해 다소 부정적인 의견을 나타냈다. 한편 산업은행은 이달중 1조5000억원 규모 인프라펀드를 조성해 대구~부산 고 속도로 건설 등에 투자할 계획이며 한국계 은행 최초로 해외 고정금리채권 발 행 주간사로 선정돼 LG전자의 8억달러 규모 글로벌본드 발행 절차를 진행하고 있다고 밝혔다. [고재만 기자] < Copyright ⓒ 매일경제. 무단전재 및 재배포 금지 >",https://n.news.naver.com/mnews/article/009/0000437634?sid=101
美 FRB 금리인상 여부에 촉각,2005-05-01 17:56:00,"이번주에는 미국 연방준비제도이사회(FRB)의 연방공개시장위원회(FOMC) 정례회 의와 4월 고용지표라는 두 가지 재료가 예정됐다. 내용에 따라서는 주가가 크 게 출렁일 수 있다. 지난주 뉴욕증시는 보합을 유지했다. 다우존스 산업평균지수는 1만192.51로 마 감돼 전주에 비해 34.80포인트(0.3%) 올랐다. 나스닥 종합지수는 10.54포인트(0.5%) 내린1,921.65로, 스탠더드앤드푸어스(S& P) 500지수는 4.73포인트(0.4%) 상승한 1,156.85로 마무리했다. 그러나 나스닥 지수가 4월 한 달 간 3.9%, 올해 초 이후로는 12%가 각각 하락 한 것을 비롯해 올 들어 주요 지수는 하락세에서 벗어나지 못하고 있다. 이번주 최대 관심은 3일(현지시간) 열리는 FOMC 회의 결과다. 시장에서는 금리 를 0.25%포인트 인상할 것으로 예상하지만 지난주 발표된 경제지표에서 성장 둔화를 확인한 만큼 금리인상에 부담이 있는 것도 사실이다. FOMC 회의 후 발표될 성명에서 주목되는 부분은 '신중한 속도'의 금리인상이라 는 표현이 유지될 지 여부다. 경제 전망에 관한 언급이 종전과 달라진다면 이 는 시장의 민감한 반응을 불러올 것이다. 이 표현이 삭제된다면 FRB가 앞으로 는 인플레이션 억제를 위해 0.25%포인트가 아니라 0.5%포인트나 그 이상의 폭 으로 금리를 올릴 것이라는 신호로 투자자들이 해석할 가능성이 크다. 반면 FRB가 경제상황에 대해 긍정적인 견해를 표명할 경우 투자자들의 우려를 잠재우는데 크게 도움이 될 것으로 예상된다. 여기에다 오는 6일 발표되는 4월 고용지표는 FOMC 성명이 증시에 미칠 영향을 극대화할 가능성이 있다. 물론 최선의 시나리오는 FOMC 회의에서 FRB가 미국 경제 전망을 밝게 평가하고 이런 전망이 고용지표를 통해 뒷받침되는 경우다. 4월의 일자리 증가 전망치는 15만5000개에서 18만8000개 사이의 범위를 보이고 있지만 이 범위를 크게 넘어서거나 밑돌 경우 증시에 파장이 클 것이 분명하다 . 이 밖에도 공급관리연구소(ISM)의 4월 제조업 및 서비스업지수와 3월 건설지출 및 공장주문, 1분기 생산성 등 중요한 경제지표의 발표가 각각 예정돼 있다. 이번주 실적을 발표할 기업으론 네트워크 업체 노텔과 정보기술(IT) 솔루션 업 체 EDS, 보험중개업체 마시앤드맥레넌과 에이온 등이다. 이들 기업 실적은 내 용에 따라 관련 업종의 등락에 영향을 미칠 것으로 보인다. 한편 국내 증시는 FOMC 결정과 각종 경제지표에 따라 추가 조정 가능성을 배제 할 수는 없지만 일단 낙폭이 컸던 만큼 기술적 반등을 기대할 수 있다. 국내 증시전문가들은 ""지난주 말 미국 증시에서 경기 둔화에 대한 염려가 완화 된 가운데 반등 패턴의 기술적 긍정성도 뒷받침되고 있다는 점에서 900선을 지 지로 하는 반등 패턴이 예상된다""고 말했다. 기술적으로 낙폭이 큰 종목과 최근 급락장에서도 선전한 경기방어주, 배당관련 주가 상대적으로 유리해 보인다. 1분기 이후 실적 호전이 기대되는 거래소 내 중소형주에 관심을 둘 필요가 있다. 프로그램 매매 잔고가 바닥권에 진입하고 있는 데다 4월 중반 이후 연기금 자 금 집행이 점차 구체화하고 있어 증시 반전에 중요한 수급원이 될 수 있다는 전망이 나오고 있다. [이상훈 기자] < Copyright ⓒ 매일경제. 무단전재 및 재배포 금지 >",https://n.news.naver.com/mnews/article/009/0000437558?sid=101
[표] 주요시세,2005-05-20 17:56:00,"======================================== 주가 ---------------------------------------- 종합주가      952.19           (▲ 0.10) 코스닥        445.86           (▲ 0.25) 뉴욕다우   10,493.19          (▲ 28.74) 나스닥      2,042.58          (▲ 11.93) S&P500      1,191.08           (▲ 5.52) 닛케이     11,037.29          (▼ 39.87) ---------------------------------------- 환율 ---------------------------------------- 1달러     1,004.40원           (▼ 0.60) 107.37엔          (▲  0.25) 100엔       933.16원          (▼  4.66) 1유로     1.2643달러        (▼  0.0023) 1,268.81원           (▼ 3.57) ---------------------------------------- 금리 ---------------------------------------- 국고채(3년)    3.66%          (▲  0.01) 회사채(AA-)    4.08%          (▲  0.01) (BBB-)   8.05%          (보　　합) CD(91일)       3.51%          (보　　합) 콜(1일)        3.30%          (▲  0.08) 미국국채(10년) 4.11%          (▲  0.04) ---------------------------------------- 환율 ---------------------------------------- 유가(WTI)    46.92달러        (▼  0.33) 금1돈(소매)   69,000원        (보　　합) 반도체(256M)  2.39달러        (보　　합) ======================================== 다우존스, 나스닥, WTI(선물), S&P500은 전날 기준. 엔ㆍ달러, 달러ㆍ유로는 도쿄 오후 5시 기준. < Copyright ⓒ 매일경제. 무단전재 및 재배포 금지 >",https://n.news.naver.com/mnews/article/009/0000441228?sid=101
사무실 유지도 힘들어 주식ㆍ땅…돈되면 투자,2005-05-17 07:26:00,"◆장학ㆍ 문화재단 저금리에 운다 (上)◆ 종교재단도 저금리로 어려움을 겪기는 마찬가지다. D교단 산하의 한 재단은 94 년부터 교단 소속 교역자의 퇴직 후 생활비를 보조하기 위해 기금을 조성하고 있다. 첫 회 기금 가입자는 223명으로 기금액 2억2000만원으로 시작됐다. 하지만 이 후 가입자가 늘면서 납입금도 늘어나 지난해 말 기준 가입자 613명, 기금액은 75억1000만원에 달한다. 최근까지 기금은 가입자 납입금과 이자수입금을 이사회 심의에서 결정해 운영 했다. 하지만 정부의 저금리 정책이 장기화할 것으로 예상되며 급여를 주기가 갈수록 어려워지자 다양한 투자를 꾀하고 있다. 기금 관리담당자는 ""97년 외환위기 이전만 해도 이자수익률이 13~15%에 달해 이자수익만으로 기금 운용에 어려움이 없었으나 이후 만성적인 긴축운영을 하 고 있다""고 설명했다. 예를 들어 지난해 기금액은 75억1000만원 선으로 투자수 익은 9% 안팎인 6억원가량이었다. 하지만 매년 지급금과 관련 비용을 포함한 지출은 10~11%가량으로 늘 1~2% 지출이 많은 편이다. 부대비용을 최소한 줄이려고 교회에서 각종 시설과 사무실 등을 제공받고 있으 나 여전히 연금을 지급하기에는 돈이 아쉬운 상황이다. D재단의 경우 가입자 납입금 대비 지급이자율은 약 13%로, 시중은행 금리를 고 려하면 곱절 이상 높은 이자율이다. 저금리 상황에서 은행 이자로만 기금을 운영하기는 턱없이 부족한 형편이다. 이에 이 교단을 비롯해 비슷한 어려움을 겪고 있는 기독교 8개 교단은 2001년 기금 운영 담당자들이 모임을 갖고 '기독교 연금협의회'를 구성했다. 이들은 매달 한 차례 모여 기금 운영을 위한 각종 재테크 정보를 교환하고 있 는데 이 자리에 증권ㆍ부동산 전문가를 초청해 기금 운용정보와 투자정보 강의 를 듣기도 한다. 이 관계자는 ""다른 교단 재단 중에는 여전히 기금 운용에 어려움이 커 앞으로 독지가 후원금에 의지하는 사례도 발생할 수 있다""고 말했다. < Copyright ⓒ 매일경제. 무단전재 및 재배포 금지 >",https://n.news.naver.com/mnews/article/009/0000365642?sid=101
